{
  "artifact_hash": "sha256:ab228204ed7a7a315b4662c08f435fd2285abe97b19212008f6257514ac74960",
  "artifact_kind": "persona_v3_ai_semantic_source_extraction",
  "candidate_id": "burry_fcic_interview_archive",
  "concise_summary": "The archive page identifies an FCIC staff audiotape involving Michael Burry but contains no transcript or playable audio bytes in the archived HTML.",
  "contradictions_ambiguities": [
    "The candidate proves an interview asset existed but does not expose semantic interview content in source.bin."
  ],
  "human_reviewed": false,
  "language": "en",
  "method_attribution_approved": false,
  "method_propositions": [],
  "model_identity": {
    "agent_task_id": "/root/ai_source_review_lane",
    "exact_deployment_id": "not_exposed_to_agent",
    "model_family": "GPT-5",
    "product": "Codex collaborating agent",
    "provider": "OpenAI"
  },
  "open_questions": [
    "Can the exact audio file be separately acquired, hashed, transcribed, and timestamp-located?"
  ],
  "persona_id": "master_burry",
  "pipeline_id": "alphacouncil_ai_semantic_source_extractor_v1",
  "production_effect": "none",
  "prompt_identity": {
    "prompt_hash": "sha256:4bc23b5351eefff5ecefd6b9725e4e541468be23e29d35a2aac222828f22a448",
    "prompt_id": "alphacouncil.source-semantic-extractor.round1.v1"
  },
  "readability": {
    "reason": "Only landing-page metadata was readable; no interview content was present.",
    "status": "partial"
  },
  "review_stage": "round_1_semantic_extraction",
  "reviewed_on": "2026-07-27",
  "reviewer_kind": "ai",
  "role": "extractor",
  "role_id": "ai_semantic_source_extractor_v1",
  "schema_version": 1,
  "source_binding": {
    "byte_length": 6245,
    "content_hash": "sha256:8176a20a17671c39b4252b212d19e69440fc05d4f9ada0a575077020db9583c6",
    "content_type": "text/html",
    "extracted_character_count": 316,
    "extracted_text_hash": "sha256:f1fa1350ff68299be3fec452b1f0dcf4ae65f44371f84bfc2ac683f300030bfd",
    "extraction_error": null,
    "extraction_tool": "alphacouncil_html_visible_text_v1",
    "final_url": "https://fcic.law.stanford.edu/interviews/view/14",
    "page_character_counts": [
      316
    ],
    "page_count": 1,
    "raw_bytes_reverified": true,
    "record_hash": "sha256:311b5a67f2f48ed19c4d24ffba9d3618243909d1c2e522f6304a039dd7bf8ee8",
    "retrieved_at": "2026-07-27T06:23:31.273Z"
  },
  "source_type": "audio_archive_landing_page"
}
