{
  "artifact_hash": "sha256:ce1b32eb3a2ada18310eb471044218378362ed9f3c50cd3e9a634a43fd9f350f",
  "artifact_kind": "persona_v3_ai_semantic_source_extraction",
  "candidate_id": "taleb_statistical_consequences_arxiv",
  "concise_summary": "The manuscript compiles theory and applications for fat-tail preasymptotics, estimation, fragility, and risk management.",
  "contradictions_ambiguities": [
    "The 523-page compilation contains heterogeneous papers and commentary; one excerpt cannot validate the whole proposed Taleb operator."
  ],
  "human_reviewed": false,
  "language": "en",
  "method_attribution_approved": false,
  "method_propositions": [
    {
      "evidence_excerpt": "the directly observable sample mean which is biased under fat-tailed distributions",
      "locator": {
        "kind": "pdf_page",
        "page": 71,
        "section": "Shadow moment",
        "text_end": null,
        "text_start": null
      },
      "proposition_id": "taleb_statistical_consequences_arxiv:p1",
      "snippet_hash": "sha256:f8361c6810dc52b197dd46c7a00451ac46eaad669a1227c798bbea9ffea5c66d",
      "statement": "Under fat-tailed distributions, avoid relying on the directly observed sample mean without examining bias and tail-parameter methods.",
      "support_strength": "direct"
    }
  ],
  "model_identity": {
    "agent_task_id": "/root/ai_source_review_lane",
    "exact_deployment_id": "not_exposed_to_agent",
    "model_family": "GPT-5",
    "product": "Codex collaborating agent",
    "provider": "OpenAI"
  },
  "open_questions": [
    "Which chapters and formulas map to each proposed decision rule, veto, and counterfactual?"
  ],
  "persona_id": "master_taleb",
  "pipeline_id": "alphacouncil_ai_semantic_source_extractor_v1",
  "production_effect": "none",
  "prompt_identity": {
    "prompt_hash": "sha256:4bc23b5351eefff5ecefd6b9725e4e541468be23e29d35a2aac222828f22a448",
    "prompt_id": "alphacouncil.source-semantic-extractor.round1.v1"
  },
  "readability": {
    "reason": "The large manuscript is text-readable.",
    "status": "readable"
  },
  "review_stage": "round_1_semantic_extraction",
  "reviewed_on": "2026-07-27",
  "reviewer_kind": "ai",
  "role": "extractor",
  "role_id": "ai_semantic_source_extractor_v1",
  "schema_version": 1,
  "source_binding": {
    "byte_length": 34102041,
    "content_hash": "sha256:758e18b7337840104db93296144d67cf5514bf2de128fe557dc84bc32a0ad567",
    "content_type": "application/pdf",
    "extracted_character_count": 899400,
    "extracted_text_hash": "sha256:d8a4975ce82934e626c108b227fef2d3f863e871f9199f75682f2a262ddde9c3",
    "extraction_error": null,
    "extraction_tool": "poppler_pdftotext_layout_utf8",
    "final_url": "https://arxiv.org/pdf/2001.10488",
    "page_character_counts": [
      209,
      1086,
      459,
      1589,
      1155,
      0,
      1515,
      1954,
      2131,
      1886,
      1871,
      1878,
      1965,
      2016,
      729,
      0,
      1120,
      2149,
      1290,
      1232,
      1456,
      1949,
      1540,
      1563,
      1825,
      1746,
      2232,
      1990,
      2400,
      2009,
      1840,
      1769,
      2324,
      1638,
      905,
      0,
      79,
      0,
      1554,
      3321,
      1195,
      691,
      1229,
      2112,
      2353,
      3306,
      3029,
      984,
      3022,
      2329,
      2887,
      3049,
      2219,
      2563,
      2787,
      1054,
      2481,
      2316,
      1315,
      1747,
      2417,
      1951,
      2705,
      1735,
      1696,
      1775,
      2739,
      2867,
      2227,
      1552,
      2416,
      2653,
      1324,
      2562,
      2470,
      1519,
      3122,
      1836,
      1837,
      1595,
      2539,
      283,
      1396,
      1156,
      3030,
      1949,
      1631,
      1568,
      1633,
      1729,
      1527,
      1836,
      2086,
      2531,
      2512,
      969,
      1509,
      1520,
      1286,
      1155,
      3178,
      2048,
      1098,
      1254,
      1658,
      1903,
      1818,
      1323,
      1990,
      1220,
      2114,
      961,
      1823,
      1747,
      1734,
      1286,
      1423,
      1422,
      1136,
      0,
      795,
      1591,
      796,
      815,
      1388,
      1867,
      1622,
      1778,
      1945,
      1650,
      1715,
      1136,
      2359,
      225,
      766,
      1994,
      2454,
      1464,
      980,
      0,
      1577,
      1468,
      1887,
      1734,
      1001,
      1181,
      580,
      0,
      33,
      0,
      1690,
      1771,
      1443,
      1749,
      1692,
      674,
      869,
      1002,
      1599,
      1620,
      1712,
      1851,
      1711,
      552,
      2078,
      332,
      2260,
      2505,
      1673,
      2247,
      1108,
      2004,
      1676,
      2520,
      3059,
      1979,
      3135,
      1604,
      1787,
      1424,
      2409,
      1571,
      1059,
      0,
      1546,
      1509,
      1412,
      1656,
      1699,
      1201,
      1462,
      994,
      1324,
      1613,
      1374,
      0,
      1342,
      909,
      1637,
      649,
      1663,
      1471,
      526,
      1335,
      1722,
      0,
      1591,
      1702,
      2491,
      1283,
      770,
      823,
      628,
      1746,
      1848,
      1840,
      963,
      633,
      1116,
      0,
      2746,
      1749,
      1212,
      726,
      1979,
      2176,
      1399,
      1687,
      846,
      921,
      83,
      0,
      1738,
      2690,
      3237,
      2421,
      2731,
      2696,
      2868,
      1191,
      3075,
      2247,
      1076,
      2289,
      2137,
      1904,
      2198,
      1754,
      1568,
      1963,
      1538,
      2137,
      2304,
      1454,
      1348,
      2284,
      2707,
      2608,
      2752,
      3520,
      3138,
      2966,
      3467,
      3020,
      2455,
      2441,
      1615,
      2464,
      821,
      2759,
      2323,
      2855,
      2899,
      304,
      2455,
      1022,
      2443,
      2154,
      1964,
      1543,
      1548,
      2112,
      2063,
      1427,
      2583,
      3130,
      3020,
      792,
      69,
      0,
      1823,
      2387,
      2966,
      2536,
      2248,
      2403,
      2632,
      2304,
      2637,
      2104,
      2799,
      2711,
      2807,
      2013,
      1621,
      1747,
      2169,
      1388,
      1855,
      1379,
      1708,
      1724,
      2491,
      2505,
      1387,
      2599,
      1726,
      1866,
      953,
      1804,
      1637,
      3368,
      2941,
      0,
      43,
      0,
      1692,
      2942,
      1601,
      1972,
      928,
      2215,
      2735,
      1028,
      791,
      0,
      2083,
      1140,
      2048,
      2495,
      1474,
      1943,
      1269,
      2903,
      2621,
      3005,
      1975,
      1079,
      3032,
      1985,
      1554,
      2219,
      1500,
      891,
      2653,
      366,
      1897,
      2050,
      2543,
      147,
      2209,
      2052,
      3492,
      3594,
      323,
      1615,
      191,
      2540,
      2403,
      2452,
      3289,
      1959,
      1166,
      1063,
      1065,
      486,
      332,
      0,
      47,
      0,
      1736,
      937,
      2217,
      842,
      1417,
      1278,
      2376,
      952,
      1371,
      824,
      270,
      0,
      1473,
      1944,
      1746,
      2131,
      1844,
      1455,
      1409,
      1335,
      1847,
      0,
      2050,
      1832,
      1558,
      1960,
      1075,
      960,
      1083,
      1546,
      133,
      0,
      1971,
      788,
      2190,
      2262,
      948,
      0,
      1105,
      1775,
      1353,
      1499,
      1381,
      1303,
      1551,
      1645,
      1268,
      0,
      63,
      0,
      1206,
      1727,
      2436,
      1174,
      2018,
      3310,
      2277,
      1441,
      1683,
      1045,
      2849,
      706,
      2056,
      3321,
      2674,
      3083,
      3197,
      3034,
      3400,
      3871,
      3122,
      3249,
      3202,
      2816,
      3144,
      2899,
      968,
      0,
      1195,
      1713,
      2198,
      1826,
      1056,
      891,
      1672,
      564,
      1781,
      3366,
      3635,
      2959,
      949,
      0,
      1968,
      2441,
      361,
      3380,
      2277,
      125,
      1614,
      2391,
      1314,
      1054,
      2042,
      3832,
      3766,
      2318,
      2262,
      1858,
      2648,
      2171,
      1487,
      711,
      1456,
      1819,
      1384,
      367,
      26,
      0,
      1858,
      2298,
      2292,
      2357,
      2333,
      2283,
      2172,
      2425,
      2215,
      2275,
      2426,
      2379,
      2088,
      2339,
      2221,
      2448,
      2375,
      2329,
      2395,
      2265,
      1220,
      0,
      1650,
      2240,
      2218
    ],
    "page_count": 523,
    "raw_bytes_reverified": true,
    "record_hash": "sha256:5493e015bb91b0c2e648631cbcc1628ec1c2e9e9070dc6b28d0ce610bec4f7fe",
    "retrieved_at": "2026-07-27T10:23:41.310Z"
  },
  "source_type": "technical_book_manuscript"
}
