{
  "artifact_hash": "sha256:9b5fdde9858915f150ba552b90759b2bff4b73d99c4e1db77e887183af1c3761",
  "artifact_kind": "persona_v3_ai_semantic_source_extraction",
  "candidate_id": "aschenbrenner_situational_awareness_2024",
  "concise_summary": "A long-form AI scenario argues for rapidly scaling compute, power, security, and national mobilization through the late 2020s.",
  "contradictions_ambiguities": [
    "The document is a forecast essay, not a verified investment record; many dates and magnitudes are speculative."
  ],
  "human_reviewed": false,
  "language": "en",
  "method_attribution_approved": false,
  "method_propositions": [
    {
      "evidence_excerpt": "the talk of the town has shifted from $10 billion compute clusters to $100 billion clusters to trillion-dollar clusters.",
      "locator": {
        "kind": "pdf_page",
        "page": 3,
        "section": "Introduction",
        "text_end": null,
        "text_start": null
      },
      "proposition_id": "aschenbrenner_situational_awareness_2024:p1",
      "snippet_hash": "sha256:71418227cb5d51e958010e4b9fe774caed70b09c4eef7269ba0d7283c375f90a",
      "statement": "Use compute-cluster spending and power procurement as leading indicators when constructing an AI infrastructure demand scenario.",
      "support_strength": "contextual"
    }
  ],
  "model_identity": {
    "agent_task_id": "/root/ai_source_review_lane",
    "exact_deployment_id": "not_exposed_to_agent",
    "model_family": "GPT-5",
    "product": "Codex collaborating agent",
    "provider": "OpenAI"
  },
  "open_questions": [
    "Which forecasts have already resolved, and what base rates should replace narrative extrapolation?"
  ],
  "persona_id": "master_aschenbrenner",
  "pipeline_id": "alphacouncil_ai_semantic_source_extractor_v1",
  "production_effect": "none",
  "prompt_identity": {
    "prompt_hash": "sha256:4bc23b5351eefff5ecefd6b9725e4e541468be23e29d35a2aac222828f22a448",
    "prompt_id": "alphacouncil.source-semantic-extractor.round1.v1"
  },
  "readability": {
    "reason": "Poppler extracted extensive readable text from the PDF.",
    "status": "readable"
  },
  "review_stage": "round_1_semantic_extraction",
  "reviewed_on": "2026-07-27",
  "reviewer_kind": "ai",
  "role": "extractor",
  "role_id": "ai_semantic_source_extractor_v1",
  "schema_version": 1,
  "source_binding": {
    "byte_length": 21371840,
    "content_hash": "sha256:68735f1b5a3d30fb276e42493389d016d4afb46fef922b44ed7ebf7ad55189d3",
    "content_type": "application/pdf",
    "extracted_character_count": 309340,
    "extracted_text_hash": "sha256:779a675179d7df79697e60ad765771f8376567fbe774ab087d51684697143aec",
    "extraction_error": null,
    "extraction_tool": "poppler_pdftotext_layout_utf8",
    "final_url": "https://situational-awareness.ai/www/wp-content/uploads/2024/06/situationalawareness.pdf?stream=top",
    "page_character_counts": [
      88,
      613,
      2455,
      1563,
      1004,
      0,
      1352,
      1245,
      1947,
      1827,
      1322,
      594,
      448,
      1468,
      2075,
      736,
      1548,
      156,
      2354,
      1831,
      1219,
      2429,
      1778,
      2567,
      2116,
      2328,
      2032,
      3133,
      1814,
      2510,
      2372,
      1528,
      1050,
      1716,
      1977,
      2872,
      1887,
      2002,
      179,
      1255,
      2096,
      955,
      1225,
      1929,
      321,
      1536,
      2148,
      967,
      2812,
      3739,
      2750,
      1830,
      2072,
      2415,
      2195,
      1974,
      1919,
      1907,
      1857,
      1970,
      2327,
      1988,
      2010,
      1685,
      1827,
      2219,
      2045,
      1287,
      2850,
      2266,
      1014,
      1947,
      1759,
      19,
      1258,
      808,
      2050,
      2760,
      944,
      1640,
      3426,
      1840,
      1494,
      2505,
      3321,
      2272,
      2193,
      1431,
      1405,
      2298,
      1387,
      2951,
      1889,
      2320,
      1931,
      2680,
      1988,
      2123,
      2255,
      1949,
      2784,
      2231,
      1014,
      113,
      1613,
      2376,
      2647,
      1036,
      1237,
      2751,
      2117,
      645,
      2047,
      1986,
      2140,
      2167,
      2150,
      2326,
      2598,
      2176,
      2157,
      2236,
      2208,
      2259,
      3424,
      1391,
      2014,
      1918,
      2028,
      1993,
      3481,
      1751,
      2933,
      1920,
      2214,
      2078,
      3551,
      2500,
      2057,
      1410,
      1210,
      2292,
      1871,
      2283,
      2922,
      1732,
      2527,
      3126,
      1964,
      2172,
      2086,
      2125,
      2204,
      2354,
      798,
      1285,
      1993,
      2044,
      2105,
      341,
      0,
      1050,
      2158,
      1773,
      880
    ],
    "page_count": 165,
    "raw_bytes_reverified": true,
    "record_hash": "sha256:31991edb3d98297fb960b57749eebe082d000d3690552fdd8f49a8ed486e2e9b",
    "retrieved_at": "2026-07-27T06:36:59.269Z"
  },
  "source_type": "scenario_essay"
}
