{
  "artifact_hash": "sha256:f018c323b73ac7202dc8506246d1c6a6f8cd3b90c0c2b9d3adfc8f854d86df00",
  "artifact_kind": "persona_v3_ai_semantic_source_extraction",
  "candidate_id": "damodaran_nyu_valuation_dubai_2026",
  "concise_summary": "The seminar presents valuation as a learnable craft and covers business models, growth, margins, reinvestment, risk, and terminal assumptions.",
  "contradictions_ambiguities": [
    "A two-word principle is well supported but does not itself define a computable valuation policy."
  ],
  "human_reviewed": false,
  "language": "en",
  "method_attribution_approved": false,
  "method_propositions": [
    {
      "evidence_excerpt": "Valuation is a craft.",
      "locator": {
        "kind": "pdf_page",
        "page": 4,
        "section": "Valuation as craft",
        "text_end": null,
        "text_start": null
      },
      "proposition_id": "damodaran_nyu_valuation_dubai_2026:p1",
      "snippet_hash": "sha256:09f7c98c44800b6460d9e9faae72af3a394d0c6ba8e9e1121ac57ad8f5fdfa59",
      "statement": "Treat valuation as an iterative craft improved by repeated application, not as exact science or irreducible artistic intuition.",
      "support_strength": "direct"
    }
  ],
  "model_identity": {
    "agent_task_id": "/root/ai_source_review_lane",
    "exact_deployment_id": "not_exposed_to_agent",
    "model_family": "GPT-5",
    "product": "Codex collaborating agent",
    "provider": "OpenAI"
  },
  "open_questions": [
    "Which exercises, error metrics, and postmortems demonstrate improvement in the craft?"
  ],
  "persona_id": "master_damodaran",
  "pipeline_id": "alphacouncil_ai_semantic_source_extractor_v1",
  "production_effect": "none",
  "prompt_identity": {
    "prompt_hash": "sha256:4bc23b5351eefff5ecefd6b9725e4e541468be23e29d35a2aac222828f22a448",
    "prompt_id": "alphacouncil.source-semantic-extractor.round1.v1"
  },
  "readability": {
    "reason": "The 209-page slide PDF is text-readable.",
    "status": "readable"
  },
  "review_stage": "round_1_semantic_extraction",
  "reviewed_on": "2026-07-27",
  "reviewer_kind": "ai",
  "role": "extractor",
  "role_id": "ai_semantic_source_extractor_v1",
  "schema_version": 1,
  "source_binding": {
    "byte_length": 25396928,
    "content_hash": "sha256:95d6d0cb929ab8b0e41db213de6c3d817b5d199763edd76bfa7bbd4a3e810011",
    "content_type": "application/pdf",
    "extracted_character_count": 85953,
    "extracted_text_hash": "sha256:3b5a7ba24c345a5eb605206fc4f46e83512dfa991edc659954dbfffea1b853f1",
    "extraction_error": null,
    "extraction_tool": "poppler_pdftotext_layout_utf8",
    "final_url": "https://pages.stern.nyu.edu/~adamodar/pdfiles/country/val2dayDubai2026.pdf",
    "page_character_counts": [
      212,
      81,
      78,
      528,
      367,
      18,
      575,
      775,
      533,
      51,
      734,
      661,
      520,
      19,
      16,
      16,
      16,
      16,
      16,
      78,
      352,
      481,
      582,
      19,
      19,
      19,
      548,
      597,
      523,
      840,
      706,
      990,
      875,
      263,
      19,
      16,
      19,
      19,
      19,
      19,
      1141,
      1551,
      360,
      302,
      19,
      19,
      432,
      888,
      19,
      132,
      225,
      665,
      405,
      612,
      19,
      730,
      565,
      19,
      630,
      19,
      19,
      19,
      468,
      465,
      111,
      658,
      326,
      19,
      776,
      514,
      693,
      229,
      756,
      43,
      559,
      290,
      254,
      2231,
      765,
      701,
      549,
      583,
      612,
      407,
      563,
      1047,
      16,
      19,
      457,
      582,
      713,
      774,
      16,
      1405,
      16,
      703,
      54,
      504,
      521,
      1269,
      1055,
      820,
      16,
      20,
      20,
      20,
      185,
      20,
      683,
      182,
      806,
      16,
      1086,
      977,
      1731,
      1108,
      74,
      399,
      747,
      604,
      171,
      20,
      623,
      545,
      680,
      1004,
      16,
      888,
      709,
      506,
      16,
      685,
      16,
      20,
      476,
      119,
      623,
      20,
      860,
      794,
      20,
      16,
      607,
      790,
      712,
      20,
      764,
      801,
      334,
      42,
      51,
      1156,
      600,
      16,
      105,
      338,
      556,
      704,
      508,
      20,
      20,
      20,
      678,
      87,
      47,
      1477,
      704,
      20,
      20,
      555,
      20,
      20,
      20,
      20,
      20,
      20,
      831,
      30,
      796,
      319,
      369,
      20,
      20,
      782,
      770,
      708,
      431,
      452,
      688,
      277,
      293,
      20,
      20,
      20,
      803,
      20,
      364,
      20,
      704,
      921,
      430,
      510,
      20,
      116,
      229,
      622,
      865,
      502,
      20
    ],
    "page_count": 209,
    "raw_bytes_reverified": true,
    "record_hash": "sha256:7b1a32bd02f52e8b7ef93ade18164765092ce0a2867dd6cef588690c48c1aebb",
    "retrieved_at": "2026-07-27T10:23:41.311Z"
  },
  "source_type": "valuation_seminar_slides"
}
